title,,tags,score,Type
Loading a single graph into a pytorch geometric data object for node classification,https://stackoverflow.com/questions/65670777,<python><python-3.x><pytorch><torch><dataloader>,2,
Estimating mixture of Gaussian models in Pytorch,https://stackoverflow.com/questions/65755730,<deep-learning><pytorch>,4,
Pytorch/cuda : CPU error and map_location,https://stackoverflow.com/questions/65842425,<deep-learning><pytorch><runtime-error>,2,
"PyTorch RuntimeError: Tensor for argument #1 'self' is on CPU, but expected them to be on GPU",https://stackoverflow.com/questions/65914706,<python><deep-learning><pytorch><logistic-regression>,2,
Pytorch already installed using Conda but fails when called,https://stackoverflow.com/questions/65921244,<deep-learning><pytorch><conda>,3,
1D CNN on Pytorch: mat1 and mat2 shapes cannot be multiplied (10x3 and 10x2),https://stackoverflow.com/questions/65945996,<python><neural-network><pytorch><torch>,5,
"Pytorch: 1D target tensor expected, multi-target not supported",https://stackoverflow.com/questions/65951522,<python><deep-learning><pytorch><conv-neural-network>,2,
How to save a model using DefaultTrainer in Detectron2?,https://stackoverflow.com/questions/66037566,<deep-learning><computer-vision><pytorch><object-recognition><detectron>,2,
"""RuntimeError: expected scalar type Double but found Float"" in Pytorch CNN training",https://stackoverflow.com/questions/66074684,<python><deep-learning><pytorch><tensor><scalar>,11,
"RuntimeError: Expected all tensors to be on the same device, but found at least two devices, cuda:0 and cpu! when resuming training",https://stackoverflow.com/questions/66091226,<python><deep-learning><pytorch><runtime-error>,94,
"Pytorch model running out of memory on both CPU and GPU, can’t figure out what I’m doing wrong",https://stackoverflow.com/questions/66203862,<deep-learning><pytorch><conv-neural-network><pytorch-lightning>,2,
How to parallelize a training loop ever samples of a batch when CPU is only available in pytorch?,https://stackoverflow.com/questions/66226135,<machine-learning><deep-learning><multiprocessing><pytorch><conv-neural-network>,19,
"UnpicklingError: A load persistent id instruction was encountered, but no persistent_load function was specified",https://stackoverflow.com/questions/66337562,<python><serialization><deep-learning><pytorch><pickle>,11,
Pytorch N - Beats model throwing error: 'str' object has no attribute '__name__',https://stackoverflow.com/questions/66342637,<machine-learning><pytorch><pytorch-lightning>,2,
"RuntimeError: Expected one of cpu, cuda, mkldnn, opengl, opencl, ideep, hip, msnpu device type at start of device string: 0",https://stackoverflow.com/questions/66427526,<python><machine-learning><pytorch>,2,
RuntimeError: CUDA error: device-side assert triggered on loss function,https://stackoverflow.com/questions/66456541,<python-3.x><deep-learning><pytorch>,4,
"Pytorch lightning metrics: ValueError: preds and target must have same number of dimensions, or one additional dimension for preds",https://stackoverflow.com/questions/66474197,<python><deep-learning><pytorch><cross-entropy><pytorch-lightning>,2,
'LSTM' object has no attribute '_flat_weights_names',https://stackoverflow.com/questions/66478043,<python><pytorch><nltk><torch>,6,
How to solve dist.init_process_group from hanging (or deadlocks)?,https://stackoverflow.com/questions/66498045,<python><machine-learning><pytorch><gpu><multi-gpu>,8,
HTTPError : HTTP Error 403: Forbidden when download MNIST dataset using pytorch,https://stackoverflow.com/questions/66516478,<python><pytorch><conv-neural-network>,2,
Transformer Model Output Nan Values in Pytorch,https://stackoverflow.com/questions/66542007,<deep-learning><pytorch><gradient><nan>,12,
RuntimeError: CUDA error: CUBLAS_STATUS_EXECUTION_FAILED when calling `cublasSgemm( handle)` with GPU only,https://stackoverflow.com/questions/66600362,<python><pytorch><gpu><conv-neural-network>,23,
"how to solve this (Pytorch RuntimeError: 1D target tensor expected, multi-target not supported)",https://stackoverflow.com/questions/66635987,<python><deep-learning><pytorch>,4,
Pytorch 1D tensors expected but got 2D tensors,https://stackoverflow.com/questions/66720543,<python><machine-learning><neural-network><pytorch><tensor>,2,
How to run LSTM on very long sequence using Truncated Backpropagation in Pytorch (lightning)?,https://stackoverflow.com/questions/66902573,<python><deep-learning><pytorch><lstm><pytorch-lightning>,3,
tgt and src have to have equal features for a Transformer Network in Pytorch,https://stackoverflow.com/questions/66921933,<machine-learning><pytorch><transformer-model><attention-model>,2,
PyTorch ValueError: Target size (torch.Size([64])) must be the same as input size (torch.Size([15])),https://stackoverflow.com/questions/66979328,<python><nlp><pytorch><conv-neural-network>,5,
How does one use Pytorch (+ cuda) with an A100 GPU?,https://stackoverflow.com/questions/66992585,<python><machine-learning><neural-network><pytorch>,46,
Use only certain layers of pretrained torchvision network,https://stackoverflow.com/questions/56455302,<image-processing><machine-learning><computer-vision><pytorch><object-detection>,2,
Passing tensorDataset or Dataloader to skorch,https://stackoverflow.com/questions/56490278,<machine-learning><deep-learning><computer-vision><pytorch><skorch>,7,
"How to fix ""ValueError: Expected input batch_size (1) to match target batch_size (4).""?",https://stackoverflow.com/questions/56515411,<python-3.x><deep-learning><pytorch>,4,
"How to fix RuntimeError ""Expected object of scalar type Float but got scalar type Double for argument""?",https://stackoverflow.com/questions/56741087,<python><neural-network><deep-learning><classification><pytorch>,123,
PyTorch - Getting the 'TypeError: pic should be PIL Image or ndarray. Got <class 'numpy.ndarray'>' error,https://stackoverflow.com/questions/56741108,<python><deep-learning><pytorch><torch><torchvision>,22,
"PyTorch DataLoader - ""IndexError: too many indices for tensor of dimension 0""",https://stackoverflow.com/questions/56745486,<python><machine-learning><pytorch>,6,
How to train the original U-Net model with PyTorch?,https://stackoverflow.com/questions/56764048,<python><conv-neural-network><pytorch><image-segmentation>,3,
RuntimeError: The size of tensor a (133) must match the size of tensor b (10) at non-singleton dimension 1,https://stackoverflow.com/questions/56783182,<python><pytorch><conv-neural-network>,11,
ImportError: Please install apex from https://www.github.com/nvidia/apex to use distributed and fp16 training,https://stackoverflow.com/questions/56850711,<python-3.x><deep-learning><nlp><pytorch>,3,
NotImplementedError: when i try to create a DataLoader object in Pytorch,https://stackoverflow.com/questions/56971163,<machine-learning><deep-learning><pytorch>,2,
"PyTorch Dimension out of range (expected to be in range of [-1, 0], but got 1)",https://stackoverflow.com/questions/57065070,<python-3.x><machine-learning><deep-learning><pytorch>,2,
"How to fix ""RuntimeError: Function AddBackward0 returned an invalid gradient at index 1 - expected type torch.FloatTensor but got torch.LongTensor""",https://stackoverflow.com/questions/57142401,<deep-learning><pytorch><machine-translation>,3,
"""RuntimeError: Expected 4-dimensional input for 4-dimensional weight 32 3 3, but got 3-dimensional input of size [3, 224, 224] instead""?",https://stackoverflow.com/questions/57237381,<python><machine-learning><pytorch><computer-vision><conv-neural-network>,34,
Trouble Converting LSTM Pytorch Model to ONNX,https://stackoverflow.com/questions/57299674,<python><deep-learning><pytorch><lstm><onnx>,4,
Unable to figure out inplace operation in the pytorch code?,https://stackoverflow.com/questions/57500582,<python><machine-learning><pytorch><lstm><recurrent-neural-network>,3,
Concatenation step of U-Net for unequal number of channels,https://stackoverflow.com/questions/57530038,<deep-learning><pytorch><image-segmentation><unet-neural-network>,2,
How To Fix: RuntimeError: size mismatch in pyTorch,https://stackoverflow.com/questions/57534072,<python><deep-learning><pytorch>,3,
How does torch.nn.DataParallel change the output size?,https://stackoverflow.com/questions/57607680,<parallel-processing><conv-neural-network><pytorch>,5,
"fastai error predicting with exported/reloaded model: ""Input type and weight type should be the same""",https://stackoverflow.com/questions/57618507,<python><deep-learning><pytorch><fast-ai>,6,
Getting truth value of array with more than one element in ambigous for albuementation transform,https://stackoverflow.com/questions/57718447,<python><machine-learning><neural-network><pytorch><albumentations>,2,
PyTorch: RuntimeError: Function MulBackward0 returned an invalid gradient at index 0 - expected type torch.cuda.FloatTensor but got torch.FloatTensor,https://stackoverflow.com/questions/57725608,<python><pytorch><backpropagation>,3,
"ValueError: Target size (torch.Size([16])) must be the same as input size (torch.Size([16, 1]))",https://stackoverflow.com/questions/57798033,<size><conv-neural-network><pytorch>,48,
how to install pytorch in python2.7?,https://stackoverflow.com/questions/57835948,<python><python-2.7><pytorch><torch>,4,
Pytorch: ValueError: Expected input batch_size (32) to match target batch_size (64),https://stackoverflow.com/questions/58059221,<python-3.x><conv-neural-network><pytorch>,2,
RuntimeError: Expected object of scalar type Long but got scalar type Float for argument #2 'mat2' how to fix it?,https://stackoverflow.com/questions/58157523,<python><neural-network><pytorch><typing>,4,
RuntimeError: Error(s) in loading state_dict for BertModel,https://stackoverflow.com/questions/58444517,<machine-learning><deep-learning><pytorch><transfer-learning>,3,
"Pytorch Autograd: what does runtime error ""grad can be implicitly created only for scalar outputs"" mean",https://stackoverflow.com/questions/58510249,<tensorflow><neural-network><pytorch><autograd><automatic-differentiation>,9,
