title,,tags,score,Type
RuntimeError: Input type (torch.FloatTensor) and weight type (torch.cuda.FloatTensor) should be the same,https://stackoverflow.com/questions/59013109,<python><python-3.x><machine-learning><deep-learning><pytorch>,185,Device
transforms.Normalize() between 0 and 1 when using Lab,https://stackoverflow.com/questions/59115888,<python><tensorflow><machine-learning><deep-learning><pytorch>,2,Normalization
How to properly implement 1D CNN for numerical data in PyTorch?,https://stackoverflow.com/questions/59125208,<python><machine-learning><neural-network><conv-neural-network><pytorch>,2,Tensor
Multi-class for sentence classification with pytorch (Using nn.LSTM),https://stackoverflow.com/questions/59177430,<python><machine-learning><neural-network><pytorch><torch>,3,Tensor
Proper dataloader setup to train fasterrcnn-resnet50 for object detection with pytorch,https://stackoverflow.com/questions/59215086,<python><machine-learning><computer-vision><pytorch><resnet>,2,Tensor
"Error during training on ResNet50: Expected 4-dimensional input for 4-dimensional weight [64, 3, 7, 7], but got input of size [8, 196608] instead",https://stackoverflow.com/questions/59434184,<python><deep-learning><computer-vision><pytorch><torchvision>,2,Tensor
"RuntimeError: Expected 4-dimensional input for 4-dimensional weight [32, 4, 8, 8], but got 2-dimensional input of size [1, 4] instead",https://stackoverflow.com/questions/59510603,<python><conv-neural-network><pytorch><reinforcement-learning><torch>,2,Tensor
CNN Pytorch Error : Input type (torch.cuda.ByteTensor) and weight type (torch.cuda.FloatTensor) should be the same,https://stackoverflow.com/questions/59582663,<python><machine-learning><conv-neural-network><pytorch>,16,Data Type
"Pytorch tensor, how to switch channel position - Runtime error",https://stackoverflow.com/questions/59648324,<python-3.x><pytorch><conv-neural-network>,23,Tensor
What are C classes for a NLLLoss loss function in Pytorch?,https://stackoverflow.com/questions/59718130,<python><machine-learning><neural-network><pytorch>,8,Tensor
"Unable to allocate GPU memory, when there is enough of cached memory",https://stackoverflow.com/questions/59805901,<amazon-ec2><deep-learning><pytorch><gpu>,3,
Dropconnect implementation in pytorch,https://stackoverflow.com/questions/59970510,<deep-learning><pytorch>,3,
Pytorch: RuntimeError: reduce failed to synchronize: cudaErrorAssert: device-side assert triggered,https://stackoverflow.com/questions/60022388,<python><machine-learning><deep-learning><pytorch>,17,
pytorch nllloss function target shape mismatch,https://stackoverflow.com/questions/60121107,<deep-learning><nlp><pytorch><lstm><loss-function>,5,
Pytorch default dataloader gets stuck for large image classification training set,https://stackoverflow.com/questions/60173417,<deep-learning><computer-vision><classification><pytorch><dataloader>,3,
Pytorch transforms.RandomRotation() does not work on Google Colab,https://stackoverflow.com/questions/60205829,<python><machine-learning><pytorch><google-colaboratory>,4,
pytorch conv2d value cannot be converted to type uint8_t without overflow,https://stackoverflow.com/questions/60253449,<python><pytorch><conv-neural-network>,6,
AttributeError: dataset object has no attribute 'c' FastAI,https://stackoverflow.com/questions/60296710,<python-3.x><deep-learning><pytorch><fast-ai><unet-neural-network>,4,
What is the correct way of encoding a large batch of documents with sentence transformers/pytorch?,https://stackoverflow.com/questions/68337487,<python><numpy><machine-learning><nlp><pytorch>,2,
PyTorch custom forward function does not work with DataParallel,https://stackoverflow.com/questions/68344572,<python-3.x><deep-learning><pytorch><multiple-gpu>,4,
CPU only pytorch is crashing with error AssertionError: Torch not compiled with CUDA enabled,https://stackoverflow.com/questions/68477345,<python><machine-learning><pytorch><python-3.7><torchvision>,4,
RTX 3070 compatibility with Pytorch,https://stackoverflow.com/questions/68529258,<deep-learning><pytorch><gpu><nvidia>,5,
"How to Fix ""AssertionError: CUDA unavailable, invalid device 0 requested""",https://stackoverflow.com/questions/68562730,<python><deep-learning><pytorch>,6,
Pytorch unable to export trained model as ONNX,https://stackoverflow.com/questions/68565147,<python-3.x><matlab><pytorch><conv-neural-network><onnx>,5,
Converting From .pt model to .h5 model,https://stackoverflow.com/questions/68577156,<python><machine-learning><keras><pytorch>,3,
torch.nn.DataParallel with torch.autograd.grad in loss function fails,https://stackoverflow.com/questions/68647895,<deep-learning><neural-network><pytorch><autograd>,2,
How to Visualize the model graph of a Graph Neural Network in Tensorboard,https://stackoverflow.com/questions/68903982,<deep-learning><pytorch><conv-neural-network><tensorboard><tensorboardx>,2,
Adding a simple attention layer to a custom resnet 18 architecture causes error in forward pass,https://stackoverflow.com/questions/69006025,<python><deep-learning><pytorch><computer-vision><attention-model>,2,
"File ""mtrand.pyx"", line 905, in numpy.random.mtrand.RandomState.choice TypeError: 'dict_keys' object cannot be interpreted as an integer",https://stackoverflow.com/questions/69018998,<python><numpy><deep-learning><pytorch><pytorch-dataloader>,2,
TypeError: unsupported format string passed to Tensor.__format__,https://stackoverflow.com/questions/69021335,<python><deep-learning><pytorch><computer-vision><tensor>,2,
"PyTorch | getting ""RuntimeError: Found dtype Long but expected Float"" with dataset Omniglot",https://stackoverflow.com/questions/69124057,<python><neural-network><pytorch>,2,
using ImageFolder with albumentations in pytorch,https://stackoverflow.com/questions/69151052,<pytorch><conv-neural-network><albumentations>,3,
potential bug when upgrading to PyTorch 1.9 ImportError: cannot import name 'int_classes' from 'torch._six',https://stackoverflow.com/questions/69170518,<python><import><deep-learning><pytorch><six>,2,
Mismatched size on BertForSequenceClassification from Transformers and multiclass problem,https://stackoverflow.com/questions/69194640,<python><deep-learning><pytorch><huggingface-transformers><bert-language-model>,7,
How can I solve the problem that method is not iterable?,https://stackoverflow.com/questions/69234232,<python><machine-learning><pytorch><autoencoder>,3,
TypeError in torch.argmax() when want to find the tokens with the highest `start` score,https://stackoverflow.com/questions/69239925,<python><pytorch><torch><huggingface-transformers><bert-language-model>,2,
Getting pytorch backward's RuntimeError: Trying to backward through the graph a second time... when slicing a tensor,https://stackoverflow.com/questions/69339143,<python><deep-learning><pytorch><autograd>,3,
"PyTorch: ""KeyError: Caught KeyError in DataLoader worker process 0.""",https://stackoverflow.com/questions/69393214,<machine-learning><image-processing><pytorch><dataset>,7,
Error in Pytorch : libcudart.so.10.2: cannot open shared object file: No such file or directory,https://stackoverflow.com/questions/69486204,<neural-network><pytorch><torch><pytorch-lightning><pytorch-geometric>,2,
StopIteration Error occurs during training while running the train.py file,https://stackoverflow.com/questions/69520913,<python><deep-learning><pytorch><stopiteration>,2,
ERROR: vars() argument must have __dict__ attribute when trying to use trainer.train() on custom HF dataset?,https://stackoverflow.com/questions/69539538,<dictionary><machine-learning><pytorch><dataset><huggingface-transformers>,4,
"PyTorch: Checking Model Accuracy Results in ""TypeError: 'bool' object is not iterable.""",https://stackoverflow.com/questions/69683898,<python><machine-learning><pytorch><attributeerror><pytorch-dataloader>,2,
Running Pytorch Quantized Model on CUDA GPU,https://stackoverflow.com/questions/69718379,<python><machine-learning><pytorch>,9,
PyTorch: How to get around the RuntimeError: in-place operations can be only used on variables that don't share storage with any other variables,https://stackoverflow.com/questions/45693586,<python><machine-learning><pytorch>,3,
PyTorch RuntimeError: Assertion `cur_target >= 0 && cur_target < n_classes' failed,https://stackoverflow.com/questions/45769206,<torch><pytorch>,13,
expected Double tensor (got Float tensor) in Pytorch,https://stackoverflow.com/questions/46546217,<machine-learning><neural-network><conv-neural-network><pytorch>,4,
Porting PyTorch code from CPU to GPU,https://stackoverflow.com/questions/46704352,<python><torch><pytorch><tensor>,7,
Cross entropy loss in pytorch nn.CrossEntropyLoss(),https://stackoverflow.com/questions/47065172,<torch><entropy><pytorch><loss><cross-entropy>,8,
how to calculate loss over a number of images and then back propagate the average loss and update network weight,https://stackoverflow.com/questions/47120126,<backpropagation><pytorch><loss>,2,
How to change the picture size in PyTorch,https://stackoverflow.com/questions/47181853,<conv-neural-network><pytorch>,10,
Pytorch: how to convert data into tensor,https://stackoverflow.com/questions/47272971,<python><machine-learning><deep-learning><pytorch>,5,
Pytorch AssertionError: Torch not compiled with CUDA enabled,https://stackoverflow.com/questions/47312396,<python><deep-learning><pytorch>,20,
"pytorch, AttributeError: module 'torch' has no attribute 'Tensor'",https://stackoverflow.com/questions/47317141,<python><python-3.5><centos7><torch><pytorch>,19,
ValueError: Floating point image RGB values must be in the 0..1 range. while using matplotlib,https://stackoverflow.com/questions/47318871,<matplotlib><deep-learning><pytorch>,5,
transfer learning [resnet18] using PyTorch. Dataset: Dog-Breed-Identification,https://stackoverflow.com/questions/47403634,<python><deep-learning><conv-neural-network><pytorch><resnet>,2,
"`THIndexTensor_(size)(target, 0) == batch_size' failed. at d:\projects\pytorch\torch\lib\thnn\generic/ClassNLLCriterion.c:54",https://stackoverflow.com/questions/47492033,<machine-learning><neural-network><deep-learning><conv-neural-network><pytorch>,3,
Setting up VGG-Face Descriptor in PyTorch,https://stackoverflow.com/questions/47645423,<python><deep-learning><torch><face-recognition><pytorch>,2,
pytorch PIP and CONDA error?,https://stackoverflow.com/questions/47943081,<python><pip><deep-learning><conda><pytorch>,2,
PyTorch Softmax Dimensions error,https://stackoverflow.com/questions/48070505,<python><machine-learning><neural-network><pytorch>,2,
"Pytorch - RuntimeError: Trying to backward through the graph a second time, but the buffers have already been freed",https://stackoverflow.com/questions/48274929,<python><deep-learning><pytorch><recurrent-neural-network><autograd>,56,
What's the reason of the error ValueError: Expected more than 1 value per channel?,https://stackoverflow.com/questions/48343857,<python><torch><pytorch>,23,
"RuntimeError: dimension out of range (expected to be in range of [-1, 0], but got 1)",https://stackoverflow.com/questions/48377214,<python><machine-learning><pytorch>,28,
Given input size: (128x1x1). Calculated output size: (128x0x0). Output size is too small,https://stackoverflow.com/questions/48402009,<python><neural-network><deep-learning><conv-neural-network><pytorch>,14,
Getting CUDA out of memory,https://stackoverflow.com/questions/48473573,<deep-learning><gpu><pytorch><nvidia>,5,
How to get around in place operation error if index leaf variable for gradient update?,https://stackoverflow.com/questions/49161652,<python><neural-network><deep-learning><gradient-descent><pytorch>,11,
pytorch error: multi-target not supported in CrossEntropyLoss(),https://stackoverflow.com/questions/49206550,<python><python-3.x><machine-learning><neural-network><pytorch>,16,
How do I re-use trained fastai models?,https://stackoverflow.com/questions/49398255,<python><scikit-learn><deep-learning><pytorch><resnet>,10,
Running through a dataloader in Pytorch using Google Colab,https://stackoverflow.com/questions/49878836,<python-3.x><image><deep-learning><image-recognition><pytorch>,6,
pytorch cnn stride error,https://stackoverflow.com/questions/50073358,<python><pytorch><stride><conv-neural-network>,4,
How to apply a custom function to specific columns in a matrix in PyTorch,https://stackoverflow.com/questions/50090821,<python><matrix><neural-network><pytorch><tensor>,8,
Pytorch: Gradient of output w.r.t parameters,https://stackoverflow.com/questions/50175711,<python><neural-network><pytorch><gradient-descent><autograd>,4,
Runtime Error: mat1 and mat2 shapes cannot be multiplied in pytorch,https://stackoverflow.com/questions/69778174,<python><deep-learning><pytorch><artificial-intelligence>,4,
PyTorch RuntimeError: Input type (torch.cuda.FloatTensor) and weight type (torch.FloatTensor) should be the same,https://stackoverflow.com/questions/69832196,<python><deep-learning><pytorch>,2,
AttributeError: module 'torch.optim.lr_scheduler' has no attribute 'LinearLR',https://stackoverflow.com/questions/69914189,<python><pytorch><object-detection><torch><torchvision>,4,
Multilayer Perceptron for multiclass classification task,https://stackoverflow.com/questions/69959778,<python><machine-learning><pytorch><multiclass-classification>,2,
How to convert from tensor to float,https://stackoverflow.com/questions/70043645,<python><tensorflow><pytorch><tensor><torch>,6,
Pytorch - IndexError: index out of range in self,https://stackoverflow.com/questions/70052109,<python><deep-learning><nlp><pytorch><lstm>,2,
CUDA OOM - But the numbers don't add upp?,https://stackoverflow.com/questions/70074789,<python><machine-learning><neural-network><pytorch>,2,
Pytorch: RuntimeError: result type Float can't be cast to the desired output type Long,https://stackoverflow.com/questions/70110429,<python><deep-learning><pytorch>,23,
"How to call ""backward"" in a loop with 2 optimizers?",https://stackoverflow.com/questions/70147878,<python><optimization><neural-network><pytorch>,2,
How does a gradient backpropagates through random samples?,https://stackoverflow.com/questions/70163823,<python><pytorch><reinforcement-learning><backpropagation>,3,
Why loss function always return zero after first epoch?,https://stackoverflow.com/questions/70178582,<python><pytorch><conv-neural-network>,2,
Setting CNN input dimensions correctly (Pytorch),https://stackoverflow.com/questions/70385325,<python><machine-learning><pytorch><conv-neural-network>,2,
Change last layer on pretrained huggingface model,https://stackoverflow.com/questions/70449122,<python><pytorch><torch><huggingface-transformers>,2,
Concatenate layers with different sizes in PyTorch,https://stackoverflow.com/questions/70487666,<python><keras><neural-network><pytorch>,3,
'Sequential' object has no attribute 'in_features' and 'fc',https://stackoverflow.com/questions/70781777,<python><deep-learning><pytorch><vgg-net>,2,
"RuntimeError: Only tuples, lists and Variables are supported as JIT inputs/outputs. Dictionaries and strings are also accepted",https://stackoverflow.com/questions/70994743,<python><machine-learning><pytorch><onnx><onnxruntime>,2,
HuggingFace: ValueError: expected sequence of length 165 at dim 1 (got 128),https://stackoverflow.com/questions/71166789,<python><deep-learning><pytorch><huggingface-transformers>,11,
RuntimeError: DataLoader worker exited unexpectedly,https://stackoverflow.com/questions/71261347,<python><machine-learning><pytorch>,5,
Cant get the right yolor pre trained weights in YOLOR,https://stackoverflow.com/questions/71278688,<python><machine-learning><pytorch><google-colaboratory>,3,
Using Focal Loss for imbalanced dataset in PyTorch,https://stackoverflow.com/questions/71300607,<python><deep-learning><pytorch><computer-vision><imbalanced-data>,2,
TypeError: 'module' object is not callable error?,https://stackoverflow.com/questions/71300827,<python-3.x><deep-learning><pytorch>,2,
Semantic segmentation with detectron2,https://stackoverflow.com/questions/71396788,<python><machine-learning><pytorch><google-colaboratory><semantic-segmentation>,2,
An error when calling tensor.backward() in pytorch may caused by grad_fn=<CopySlices>,https://stackoverflow.com/questions/71408271,<python><machine-learning><pytorch>,3,
OSError while calling Detectron2LayoutModel,https://stackoverflow.com/questions/71483333,<python><deep-learning><pytorch><oserror>,2,
Pytorch RuntimeError: CUDA out of memory with a huge amount of free memory,https://stackoverflow.com/questions/71498324,<python><machine-learning><pytorch><computer-vision>,34,
"Using a target size (torch.Size([16])) that is different to the input size (torch.Size([16, 2])) is deprecated",https://stackoverflow.com/questions/71547452,<python><machine-learning><deep-learning><neural-network><pytorch>,3,
"ValueError: num_samples should be a positive integer value, but got num_samples=0",https://stackoverflow.com/questions/71615089,<python><deep-learning><path><pytorch><dataset>,4,
HuggingFace Datasets to PyTorch,https://stackoverflow.com/questions/71662768,<python><machine-learning><pytorch><computer-vision><huggingface-datasets>,3,
"While running a Pytorch CNN built with Sequential I am receiving an error ""Shapes Cannot be Multiplied"" but I checked that the shapes match",https://stackoverflow.com/questions/71759758,<python><pytorch><conv-neural-network><sequential><max-pooling>,2,
"RuntimeError: expected scalar type Long but found Int in loss = criterion(outputs, y_train)",https://stackoverflow.com/questions/60300668,<python><deep-learning><pytorch>,2,
Re-using a classification CNN model for autoencoding - pytorch,https://stackoverflow.com/questions/60365105,<python><pytorch><conv-neural-network><autoencoder>,3,
pytorch DataLoader: `Tensors must have same number of dimensions`,https://stackoverflow.com/questions/60414698,<python><python-3.x><numpy><machine-learning><pytorch>,2,
"Beginner PyTorch - RuntimeError: shape '[16, 400]' is invalid for input of size 9600",https://stackoverflow.com/questions/60439570,<neural-network><artificial-intelligence><pytorch><conv-neural-network>,10,
RuntimeError: expected scalar type Long but found Float,https://stackoverflow.com/questions/60440292,<python><machine-learning><deep-learning><neural-network><pytorch>,52,
"Pytorch ""upsample_bilinear2d_out_frame"" not implemented for 'Byte'",https://stackoverflow.com/questions/60475895,<python><pytorch><object-detection><torch><torchvision>,2,
Invalid device id when using pytorch dataparallel！,https://stackoverflow.com/questions/60750288,<python-3.x><deep-learning><pytorch>,5,
Using WeightedRandomSampler in PyTorch,https://stackoverflow.com/questions/60812032,<machine-learning><deep-learning><computer-vision><pytorch>,8,
Pytorch - Concatenating Datasets before using Dataloader,https://stackoverflow.com/questions/60840500,<python><tensorflow><machine-learning><dataset><pytorch>,15,
"Pytorch, slicing tensor causes RuntimeError:: one of the variables needed for gradient computation has been modified by an inplace operation:",https://stackoverflow.com/questions/60869124,<machine-learning><regression><pytorch>,3,
"IndexError: tensors used as indices must be long, byte or bool tensors",https://stackoverflow.com/questions/60873477,<python><list><image><deep-learning><pytorch>,5,
Using flatten in pytorch v1.0 Sequential module,https://stackoverflow.com/questions/61039700,<python><pytorch><conv-neural-network>,4,
PyTorch Model throwing error for list of layers,https://stackoverflow.com/questions/61116039,<python-3.x><pytorch><torch>,3,
How to use custom torch.autograd.Function in nn.Sequential model,https://stackoverflow.com/questions/61117361,<python><pytorch><torch>,2,
How to solve ' CUDA out of memory. Tried to allocate xxx MiB' in pytorch?,https://stackoverflow.com/questions/61234957,<machine-learning><deep-learning><pytorch><nvidia><conv-neural-network>,11,
"pytorch geometric ""Detected that PyTorch and torch_sparse were compiled with different CUDA versions"" on google colab",https://stackoverflow.com/questions/61297150,<pytorch><google-colaboratory><torch>,5,
bool value of Tensor with more than one value is ambiguous,https://stackoverflow.com/questions/61334483,<pytorch><torch>,4,
how to set values for layers in pytorch nn.module?,https://stackoverflow.com/questions/61335217,<python><pytorch><conv-neural-network><vgg-net>,2,
Getting error when using print() or summary() in pytorch to see the layers and weight dimensions in a Pytorch model,https://stackoverflow.com/questions/61352375,<machine-learning><neural-network><pytorch><conv-neural-network><resnet>,2,
Resuming pytorch model training raises error “CUDA out of memory”,https://stackoverflow.com/questions/61509872,<python><pytorch><conv-neural-network><resuming-training>,2,
pytorch: How to do layer wise multiplication?,https://stackoverflow.com/questions/61555342,<python><deep-learning><pytorch><tensor>,2,
"RuntimeError: stack expects each tensor to be equal size, but got [32, 1] at entry 0 and [32, 0] at entry 1",https://stackoverflow.com/questions/61558291,<python><deep-learning><pytorch><tensor>,3,
'Net' object has no attribute 'parameters',https://stackoverflow.com/questions/61703398,<deep-learning><neural-network><pytorch><conv-neural-network>,4,
How do I use one-hot encoding with cross-entropy loss?,https://stackoverflow.com/questions/61723290,<python><tensorflow><machine-learning><computer-vision><pytorch>,2,
Pytorch RuntimeError: element 0 of tensors does not require grad and does not have a grad_fn,https://stackoverflow.com/questions/61808965,<python><deep-learning><pytorch><gradient><reinforcement-learning>,17,
"PyTorch ""Caught IndexError in DataLoader worker process 0"", ""IndexError: too many indices for array""",https://stackoverflow.com/questions/61900138,<python><machine-learning><deep-learning><pytorch>,5,
Pad torch tensors of different sizes to be equal,https://stackoverflow.com/questions/61943896,<python><machine-learning><pytorch><padding><tensor>,5,
How do I load up an image and convert it to a proper tensor for PyTorch?,https://stackoverflow.com/questions/50420168,<python><image-processing><python-imaging-library><pytorch><conv-neural-network>,6,
can't import torch mac,https://stackoverflow.com/questions/50425739,<python><macos><pytorch><torch>,3,
"Pytorch, can't run backward() on even the most simple network without getting an error",https://stackoverflow.com/questions/50446675,<machine-learning><neural-network><pytorch><feed-forward>,2,
Pytorch - Incorrect dimensions when using LSTM network,https://stackoverflow.com/questions/50557039,<deep-learning><lstm><pytorch>,3,
from torch._C import * ImportError: DLL load failed: The specified module could not be found,https://stackoverflow.com/questions/50612899,<python><machine-learning><pytorch>,11,
Overflow when unpacking long - Pytorch,https://stackoverflow.com/questions/50617917,<python-3.x><deep-learning><pytorch>,9,
PyTorch: copy_if failed to synchronize: device-side assert triggered,https://stackoverflow.com/questions/50852294,<python><machine-learning><pytorch>,4,
Pytorch inceptionV3 transfer learning gives error - max() received an invalid combination of arguments,https://stackoverflow.com/questions/51045839,<python><deep-learning><pytorch><conv-neural-network>,3,
RuntimeError: Expected object of type torch.FloatTensor but found type torch.cuda.DoubleTensor for argument #2 'weight',https://stackoverflow.com/questions/51081004,<neural-network><pytorch><torch>,3,
GPU program failed to execute : cublas runtime error,https://stackoverflow.com/questions/51280089,<deep-learning><conv-neural-network><pytorch>,2,
Implementing a custom dataset with PyTorch,https://stackoverflow.com/questions/51545026,<python><machine-learning><neural-network><pytorch>,3,
Why doesn't my simple pytorch network work on GPU device?,https://stackoverflow.com/questions/51605893,<python><image-processing><machine-learning><deep-learning><pytorch>,11,
Issue with running a single prediction with PyTorch,https://stackoverflow.com/questions/51701908,<pytorch><torch>,2,
How do I turn a Pytorch Dataloader into a numpy array to display image data with matplotlib?,https://stackoverflow.com/questions/51756581,<python><numpy><machine-learning><conv-neural-network><pytorch>,8,
Change dimensions of image when creating custom dataloader in pytorch,https://stackoverflow.com/questions/51769200,<python><machine-learning><deep-learning><conv-neural-network><pytorch>,2,
"Pytorch RuntimeError: ""host_softmax"" not implemented for 'torch.cuda.LongTensor'",https://stackoverflow.com/questions/51818225,<deep-learning><pytorch>,14,
Expected parameters of Conv2d,https://stackoverflow.com/questions/51885408,<machine-learning><deep-learning><conv-neural-network><convolution><pytorch>,4,
Pytorch model accuracy test,https://stackoverflow.com/questions/52176178,<python><conv-neural-network><pytorch>,7,
Expected tensor for argument #1 'input' to have the same dimension,https://stackoverflow.com/questions/52408753,<python><machine-learning><deep-learning><conv-neural-network><pytorch>,2,
pytorch restore model with different batch size,https://stackoverflow.com/questions/52425824,<python><neural-network><deep-learning><pytorch>,4,
Why would Pytorch (CUDA) be running slow on GPU,https://stackoverflow.com/questions/52458508,<python><machine-learning><pytorch>,3,
how to convert pytorch adaptive_avg_pool2d method to keras or tensorflow,https://stackoverflow.com/questions/52622518,<tensorflow><keras><deep-learning><pytorch><spatial-pooling>,5,
PyTorch RuntimeError Invalid argument 2 of size,https://stackoverflow.com/questions/52761666,<python><neural-network><deep-learning><conv-neural-network><pytorch>,2,
