title,,tags,score,Type
PyTorch: create non-fully-connected layer / concatenate output of hidden layers,https://stackoverflow.com/questions/52994435,<python><neural-network><pytorch>,4,
"AttributeError: 'tuple' object has no attribute 'dim', when feeding input to Pytorch LSTM network",https://stackoverflow.com/questions/53032586,<python><tuples><lstm><pytorch><torch>,6,
"RuntimeError: Given groups=1, weight of size [64, 3, 7, 7], expected input[3, 1, 224, 224] to have 3 channels, but got 1 channels instead",https://stackoverflow.com/questions/53416833,<python><deep-learning><pytorch><tensor>,3,
how to save torchtext Dataset?,https://stackoverflow.com/questions/53421999,<python><pickle><pytorch><torch><torchtext>,5,
ValueError: expected 2D or 3D input (got 1D input) PyTorch,https://stackoverflow.com/questions/53500511,<python><machine-learning><deep-learning><pytorch>,3,
Concatenate Two Tensors in Pytorch,https://stackoverflow.com/questions/53512281,<python><machine-learning><deep-learning><pytorch><tensor>,7,
TypeError: can't convert cuda:0 device type tensor to numpy. Use Tensor.cpu() to copy the tensor to host memory first,https://stackoverflow.com/questions/61964863,<python><numpy><deep-learning><pytorch>,2,
RuntimeError: one of the variables needed for gradient computation has been modified by an inplace operation?,https://stackoverflow.com/questions/62061703,<python><deep-learning><computer-vision><pytorch><generative-adversarial-network>,11,
How to solve error: no match between expected input batch size and target batch size in PyTorch?,https://stackoverflow.com/questions/62157890,<python><machine-learning><deep-learning><pytorch>,2,
Understanding input shape to PyTorch conv1D?,https://stackoverflow.com/questions/62372938,<pytorch><conv-neural-network>,13,
"RuntimeError: Given groups=1, weight of size [32, 3, 16, 16, 16], expected input[100, 16, 16, 16, 3] to have 3 channels, but got 16 channels instead",https://stackoverflow.com/questions/62416819,<python><pytorch><conv-neural-network><pytorch-lightning>,14,
Pytorch: Dimensions for cross entropy is correct but somehow wrong for MSE?,https://stackoverflow.com/questions/62422644,<python><machine-learning><image-processing><computer-vision><pytorch>,2,
How does one implemented a parametrized meta-learner in Pytorch's higher library?,https://stackoverflow.com/questions/62459891,<machine-learning><deep-learning><pytorch>,2,
"Intermittent ""RuntimeError: CUDA out of memory"" error in Google Colab Fine Tuning BERT Base Cased with Transformers and PyTorch",https://stackoverflow.com/questions/62468346,<python><machine-learning><pytorch><google-colaboratory>,5,
AutoTokenizer.from_pretrained fails to load locally saved pretrained tokenizer (PyTorch),https://stackoverflow.com/questions/62472238,<python><deep-learning><pytorch><huggingface-transformers><huggingface-tokenizers>,7,
how to modify resnet 50 with 4 channels as input using pre-trained weights in Pytorch?,https://stackoverflow.com/questions/62629114,<python><image-processing><deep-learning><computer-vision><pytorch>,12,
Pytorch: RuntimeError: expected dtype Float but got dtype Long,https://stackoverflow.com/questions/62726792,<python><deep-learning><pytorch><backpropagation>,12,
MNIST dataset is failed to transform as tensor object,https://stackoverflow.com/questions/62873654,<python><numpy><machine-learning><pytorch>,2,
Is it possible to use non-pytoch augmentation in transform.compose,https://stackoverflow.com/questions/62922324,<python><deep-learning><pytorch><artificial-intelligence><data-augmentation>,3,
PyTorch AttributeError: 'UNet3D' object has no attribute 'size',https://stackoverflow.com/questions/62985943,<deep-learning><pytorch><transfer-learning>,3,
PyTorch - RuntimeError: Error(s) in loading state_dict for VGG:,https://stackoverflow.com/questions/63001490,<machine-learning><deep-learning><pytorch>,4,
PyTorch multiprocessing error with Hogwild,https://stackoverflow.com/questions/63081486,<python><machine-learning><deep-learning><multiprocessing><pytorch>,15,
How do I make custom pytorch datasets structured like the torchvision datasets?,https://stackoverflow.com/questions/63125160,<python><pytorch><torch>,2,
Pytorch CUDA OutOfMemory Error while training,https://stackoverflow.com/questions/63441299,<python><pytorch><torch><amazon-sagemaker><torchvision>,3,
How can torchaudio.transform.Resample be called without __call__ function inside?,https://stackoverflow.com/questions/63480624,<python><class><machine-learning><deep-learning><pytorch>,2,
how to implement ResNet50 in PyTorch?,https://stackoverflow.com/questions/63591609,<python><neural-network><pytorch><conv-neural-network>,2,
Pytorch geometric: Having issues with tensor sizes,https://stackoverflow.com/questions/63610626,<python><machine-learning><pytorch><data-science>,4,
Pytorch crossentropy loss with 3d input,https://stackoverflow.com/questions/63648735,<python><neural-network><pytorch><cross-entropy>,4,
AssertionError: Torch not compiled with CUDA enabled (problem in torch vision),https://stackoverflow.com/questions/63781490,<neural-network><pytorch><object-detection><torchvision>,2,
Anaconda reading wrong CUDA version,https://stackoverflow.com/questions/63842961,<tensorflow><pytorch><conda><torch>,8,
"RuntimeError: Expected 3-dimensional input for 3-dimensional weight [64, 512, 1], but got 2-dimensional input of size [4, 512] instead",https://stackoverflow.com/questions/63885053,<deep-learning><pytorch><conv-neural-network>,2,
Can't iterate through PyTorch DataLoader,https://stackoverflow.com/questions/63927648,<python><pandas><deep-learning><iterator><pytorch>,2,
OSError: cannot identify image file,https://stackoverflow.com/questions/43418825,<classification><deep-learning><pytorch>,2,
Trying to load a custom dataset in Pytorch,https://stackoverflow.com/questions/43441673,<python><machine-learning><computer-vision><dataset><pytorch>,4,
pytorch Network.parameters() missing 1 required positional argument: 'self',https://stackoverflow.com/questions/43779500,<python><machine-learning><pytorch><computer-vision>,10,
"pytorch custom layer ""is not a Module subclass""",https://stackoverflow.com/questions/44406819,<torch><pytorch><autograd>,10,
How to parallelize RNN function in Pytorch with DataParallel,https://stackoverflow.com/questions/44595338,<torch><recurrent-neural-network><pytorch>,3,
subtraction of scalar from tensor yields 'inconsistent tensor size' in pytorch,https://stackoverflow.com/questions/44631520,<torch><subtraction><pytorch>,2,
Pytorch: Convert FloatTensor into DoubleTensor,https://stackoverflow.com/questions/44717100,<python><torch><pytorch>,18,
Find number of non-zero elements in a tensor along an aixs,https://stackoverflow.com/questions/44857373,<python><deep-learning><pytorch>,3,
Confused about tensor dimensions and batch sizes in pytorch,https://stackoverflow.com/questions/45020108,<python><machine-learning><neural-network><deep-learning><pytorch>,6,
Understanding a simple LSTM pytorch,https://stackoverflow.com/questions/45022734,<neural-network><lstm><pytorch><recurrent-neural-network>,35,
How to get mini-batches in pytorch in a clean and efficient way?,https://stackoverflow.com/questions/45113245,<python><numpy><machine-learning><deep-learning><pytorch>,61,
Tensor type mismatch when moving to GPU,https://stackoverflow.com/questions/45446983,<python><deep-learning><pytorch>,8,
"Simple but disturbing problem about function ""tensor.backward()"" in PyTorch",https://stackoverflow.com/questions/53578605,<python><deep-learning><pytorch>,4,
How to connect the input to the output directly using single fully connected layer in PyTorch?,https://stackoverflow.com/questions/53586245,<python><deep-learning><conv-neural-network><pytorch><torch>,2,
Why does this error pop up while working with Deep Q learning?,https://stackoverflow.com/questions/53639839,<python><deep-learning><artificial-intelligence><pytorch>,4,
can't find the inplace operation: one of the variables needed for gradient computation has been modified by an inplace operation,https://stackoverflow.com/questions/53691156,<python><pytorch><backpropagation>,8,
How to change a Pytorch CNN to take color images instead of black and white?,https://stackoverflow.com/questions/53769948,<python><image><conv-neural-network><pytorch>,3,
IndexError when iterating my dataset using Dataloader in PyTorch,https://stackoverflow.com/questions/53810497,<machine-learning><deep-learning><computer-vision><pytorch>,2,
Pytorch - inference all images and back-propagate batch by batch,https://stackoverflow.com/questions/53843711,<python><deep-learning><pytorch>,7,
PyTorch - How to deactivate dropout in evaluation mode,https://stackoverflow.com/questions/53879727,<python><deep-learning><lstm><pytorch><dropout>,30,
TypeError: can’t convert CUDA tensor to numpy. Use Tensor.cpu() to copy the tensor to host memory first,https://stackoverflow.com/questions/53900910,<numpy><neural-network><pytorch><pruning>,60,
Problem with missing and unexpected keys while loading my model in Pytorch,https://stackoverflow.com/questions/53907073,<python><machine-learning><neural-network><conv-neural-network><pytorch>,15,
"TypeError: add(): argument 'other' (position 1) must be Tensor, not numpy.ndarray",https://stackoverflow.com/questions/53938977,<machine-learning><pytorch><kaggle><resnet><fast-ai>,4,
Pytorch: AttributeError: cannot assign module before Module.__init__() call even if initialized,https://stackoverflow.com/questions/54053256,<python-3.x><deep-learning><pytorch>,2,
RuntimeError: Error(s) in loading state_dict for ResNet:,https://stackoverflow.com/questions/54058256,<python-3.x><deep-learning><pytorch><resnet>,16,
Expect FloatTensors but got LongTensors in MNIST-like task,https://stackoverflow.com/questions/54085357,<python><machine-learning><deep-learning><computer-vision><pytorch>,2,
How to fix 'cannot initialize type TensorProto DataType' error while importing torch?,https://stackoverflow.com/questions/54096158,<pytorch><torch>,2,
ModuleNotFoundError: No module named 'torch.utils.serialization',https://stackoverflow.com/questions/54107156,<python><python-3.x><pytorch><torch>,3,
Implementing dropout from scratch,https://stackoverflow.com/questions/54109617,<python><machine-learning><deep-learning><pytorch><dropout>,21,
"UnpicklingError: invalid load key, '\x0a'",https://stackoverflow.com/questions/54117962,<python-3.x><neural-network><pytorch>,6,
pytorch instance tensor not moved to gpu even with explicit cuda() call,https://stackoverflow.com/questions/54155969,<python><machine-learning><artificial-intelligence><pytorch>,9,
RuntimeError: PyTorch does not currently provide packages for PyPI,https://stackoverflow.com/questions/54274089,<python><pytorch><torch>,2,
packed_padded_sequence gives error when used with GPU,https://stackoverflow.com/questions/54358280,<python><deep-learning><gpu><pytorch>,4,
Pytorch RuntimeError: Invalid index in gather,https://stackoverflow.com/questions/54380830,<python><deep-learning><pytorch>,5,
How to balance (oversampling) unbalanced data in PyTorch (with WeightedRandomSampler)?,https://stackoverflow.com/questions/54415345,<python><machine-learning><pytorch><data-cleaning>,3,
PyTorch runtime error : invalid argument 0: Sizes of tensors must match except in dimension 1,https://stackoverflow.com/questions/54417736,<deep-learning><pytorch>,4,
net.load_state_dict(torch.load('rnn_x_epoch.net')) not working on cpu,https://stackoverflow.com/questions/54435133,<neural-network><pytorch><torch>,2,
Pytorch ValueError: optimizer got an empty parameter list,https://stackoverflow.com/questions/54678896,<python><machine-learning><pytorch><reinforcement-learning><backpropagation>,28,
Concat tensors in PyTorch,https://stackoverflow.com/questions/54727686,<python><machine-learning><pytorch><tensor>,6,
Input dimension error on pytorch's forward check,https://stackoverflow.com/questions/54749244,<python><python-3.x><machine-learning><pytorch>,2,
RNN model (GRU) of word2vec to regression not learning,https://stackoverflow.com/questions/54824768,<python><tensorflow><machine-learning><keras><pytorch>,3,
UserWarning: The .grad attribute of a Tensor that is not a leaf Tensor is being accessed,https://stackoverflow.com/questions/71958197,<python><deep-learning><pytorch><logistic-regression>,2,
Pytorch optimizer returns empty,https://stackoverflow.com/questions/72006790,<python><pytorch><conv-neural-network>,2,
"How to fix ""initial_lr not specified when resuming optimizer"" error for scheduler?",https://stackoverflow.com/questions/72058575,<python><machine-learning><pytorch><scheduler>,2,
"UserWarning: Using a target size (torch.Size([1])) that is different to the input size (torch.Size([1, 1]))",https://stackoverflow.com/questions/72061934,<deep-learning><pytorch>,7,
pytorch gather failed with sparse_grad=True,https://stackoverflow.com/questions/72239086,<python><pytorch><backpropagation>,5,
`torch.cuda.Event()` throws error `TypeError: object.__new__() takes exactly one argument (the type to instantiate)`,https://stackoverflow.com/questions/72278094,<python><constructor><pytorch><torch>,4,
AttributeError: 'Upsample' object has no attribute 'recompute_scale_factor',https://stackoverflow.com/questions/72297590,<python-3.x><pytorch><torch>,8,
Matrix 2D on Convolutional Netowrk,https://stackoverflow.com/questions/72331271,<python><machine-learning><pytorch><conv-neural-network>,2,
"RuntimeError: Given groups=1, weight of size [6, 3, 3, 3], expected input[4, 224, 3, 224] to have 3 channels, but got 224 channels instead",https://stackoverflow.com/questions/72538897,<python><pytorch><conv-neural-network><artificial-intelligence><torch>,2,
mat1 and mat2 shapes cannot be multiplied (128x4 and 128x64),https://stackoverflow.com/questions/72724452,<python><pytorch><conv-neural-network>,2,
Pytorch identifying batch size as number of channels in Conv2d layer,https://stackoverflow.com/questions/72808402,<python><neural-network><pytorch><conv-neural-network><autoencoder>,2,
Error happend when import torch (pytorch),https://stackoverflow.com/questions/73098560,<python><windows><deep-learning><pytorch>,2,
"RuntimeError: Expected 3D (unbatched) or 4D (batched) input to conv2d, but got input of size: [64, 2]",https://stackoverflow.com/questions/73265333,<python><machine-learning><deep-learning><pytorch><conv-neural-network>,2,
"ValueError: base_distribution needs to have shape with size at least 6, but got torch.Size([6])",https://stackoverflow.com/questions/73445876,<python><deep-learning><pytorch><tensor>,3,
Defining my own gradient function for pytorch to use,https://stackoverflow.com/questions/73532345,<numpy><pytorch><tensor><torch>,4,
Apply math operation dynamically between two nn.Modules or loss functions,https://stackoverflow.com/questions/73599363,<python><neural-network><pytorch><automl>,5,
Why don't the images align when concatenating two data sets in pytorch using torch.utils.data.ConcatDataset?,https://stackoverflow.com/questions/73913522,<python><machine-learning><pytorch><dataset>,3,
How to fine-tune gpt-j using Huggingface Trainer,https://stackoverflow.com/questions/74014379,<python><machine-learning><pytorch><huggingface-transformers><huggingface>,4,
How to stop logging locally but only save to wandb's servers and have wandb work using soft links?,https://stackoverflow.com/questions/74175401,<python><machine-learning><deep-learning><pytorch><wandb>,2,
Coco_eval - Average Precision and Recall,https://stackoverflow.com/questions/74207204,<python><machine-learning><deep-learning><pytorch>,2,
TypeError: 'Adam' object is not callable,https://stackoverflow.com/questions/74238235,<python><deep-learning><pytorch>,2,
KeyError: 'eval_loss' in Hugginface Trainer,https://stackoverflow.com/questions/74239556,<python-3.x><machine-learning><pytorch><huggingface-transformers><huggingface-tokenizers>,2,
ImportError: libtinfo.so.5: cannot open shared object file: No such file or directory,https://stackoverflow.com/questions/74261921,<python-3.x><pytorch><importerror><torch><fast-ai>,3,
TypeError: __init__() got an unexpected keyword argument 'device_type' in torch.cuda.autocast,https://stackoverflow.com/questions/74746481,<python><machine-learning><pytorch><neural-network>,2,
mat1 and mat2 must have the same dtype,https://stackoverflow.com/questions/75102134,<python><machine-learning><pytorch><data-science>,5,
TypeError: No loop matching the specified signature and casting was found for ufunc greater,https://stackoverflow.com/questions/75117132,<python><numpy><deep-learning><pytorch><yolov5>,2,
"""Unsupported number of image dimensions"" while using image_utils from Transformers",https://stackoverflow.com/questions/75168665,<python><numpy><machine-learning><pytorch><huggingface-transformers>,3,
RuntimeError: _thnn_mse_loss_forward is not implemented for type torch.cuda.LongTensor,https://stackoverflow.com/questions/54878415,<python><image-processing><machine-learning><computer-vision><pytorch>,7,
Fastai learner not loading,https://stackoverflow.com/questions/54914106,<machine-learning><model><pytorch><resnet><fast-ai>,9,
Pytorch CNN error: Expected input batch_size (4) to match target batch_size (64),https://stackoverflow.com/questions/54928638,<python><machine-learning><computer-vision><conv-neural-network><pytorch>,3,
Pytorch TypeError: eq() received an invalid combination of arguments,https://stackoverflow.com/questions/54999926,<numpy><image-processing><machine-learning><computer-vision><pytorch>,2,
Torchtext AttributeError: 'Example' object has no attribute 'text_content',https://stackoverflow.com/questions/55060888,<neural-network><nlp><pytorch><recurrent-neural-network><torchtext>,5,
Implementation of VGG16 on Pytorch giving size mismatch error,https://stackoverflow.com/questions/55145561,<python><deep-learning><computer-vision><conv-neural-network><pytorch>,2,
How to pass parameters to forward function of my torch nn.module from skorch.NeuralNetClassifier.fit(),https://stackoverflow.com/questions/55156877,<python><scikit-learn><neural-network><pytorch><skorch>,3,
"Pytorch - why does preallocating memory cause ""trying to backward through the graph a second time""",https://stackoverflow.com/questions/55268726,<pytorch><backpropagation><tensor><autograd><autodiff>,5,
"RuntimeError: Expected object of backend CUDA but got backend CPU for argument: ret = torch.addmm(torch.jit._unwrap_optional(bias), input, weight.t())",https://stackoverflow.com/questions/55278566,<python><pytorch><torch><tensor>,12,
"In Colaboratory, CUDA cannot be used for the torch",https://stackoverflow.com/questions/55368921,<pytorch><google-colaboratory><torch>,17,
Error libtorch_python.so: cannot open shared object file: No such file or directory,https://stackoverflow.com/questions/55476131,<python><pip><pytorch><torch><python-3.7>,9,
Pytorch loss function error in the last batch,https://stackoverflow.com/questions/55507391,<python><machine-learning><pytorch><loss-function>,2,
how to load the gpu trained model into the cpu?,https://stackoverflow.com/questions/55511857,<gpu><conv-neural-network><pytorch><cudnn><pre-trained-model>,11,
Pytorch doesn't support one-hot vector?,https://stackoverflow.com/questions/55549843,<python><machine-learning><pytorch>,28,
Issues converting Keras code into PyTorch code (shaping),https://stackoverflow.com/questions/55636138,<machine-learning><keras><deep-learning><pytorch>,2,
Adam optimizer error: one of the variables needed for gradient computation has been modified by an inplace operation,https://stackoverflow.com/questions/55673412,<optimization><error-handling><deep-learning><pytorch><reinforcement-learning>,2,
How downsample work in ResNet in pytorch code?,https://stackoverflow.com/questions/55688645,<python><deep-learning><pytorch><conv-neural-network><torchvision>,11,
Creating a Simple 1D CNN in PyTorch with Multiple Channels,https://stackoverflow.com/questions/55720464,<python><neural-network><conv-neural-network><pytorch><torch>,5,
Missing Keys in state_dict,https://stackoverflow.com/questions/55744941,<image-processing><machine-learning><computer-vision><pytorch><generative-adversarial-network>,2,
Expected object of scalar type Long but got scalar type Byte for argument #2 'target',https://stackoverflow.com/questions/55762581,<python><tensorflow><deep-learning><pytorch><google-colaboratory>,3,
The `device` argument should be set by using `torch.device` or passing a string as an argument,https://stackoverflow.com/questions/55883389,<python><machine-learning><deep-learning><nlp><pytorch>,5,
PyTorch: _thnn_nll_loss_forward is not implemented for type torch.LongTensor,https://stackoverflow.com/questions/55914172,<python><machine-learning><computer-vision><pytorch><loss-function>,5,
RuntimeError: Assertion `cur_target >= 0 && cur_target < n_classes' failed,https://stackoverflow.com/questions/55981101,<python><python-3.x><machine-learning><pytorch><cross-entropy>,2,
pytorch embedding index out of range,https://stackoverflow.com/questions/56010551,<python><neural-network><nlp><pytorch><recurrent-neural-network>,13,
Inplace arithmetic operation versus normal arithmetic operation in PyTorch Tensors,https://stackoverflow.com/questions/56019560,<python><machine-learning><pytorch>,2,
Pytorch RuntimeError: Expected tensor for argument #1 'indices' to have scalar type Long; but got CUDAType instead,https://stackoverflow.com/questions/56360644,<python-3.x><pytorch><torch><embedding>,39,
Moving a tensor to cuda device cause illegal memory access in Pytorch,https://stackoverflow.com/questions/63951247,<python><deep-learning><pytorch><google-colaboratory>,4,
Input fixed length sequence of frames to CNN,https://stackoverflow.com/questions/64100096,<python><pytorch><tensor><conv-neural-network>,2,
Error in transformation of EMNIST data through Pytorch,https://stackoverflow.com/questions/64173581,<python><numpy><deep-learning><pytorch><mnist>,2,
How to restructure the output tensor of a cnn layer for use by a linear layer in a simple pytorch model,https://stackoverflow.com/questions/64263839,<python><deep-learning><pytorch>,3,
retain_graph problem with GRU in Pytorch 1.6,https://stackoverflow.com/questions/64355112,<python-3.x><machine-learning><deep-learning><pytorch><torch>,3,
Python3 Pytorch RuntimeError on GCP - no msg,https://stackoverflow.com/questions/64356499,<python-3.x><tensorflow><google-cloud-platform><neural-network><pytorch>,2,
RuntimeError: Can only calculate the mean of floating types. Got Byte instead. for mean += images_data.mean(2).sum(0),https://stackoverflow.com/questions/64358283,<python><deep-learning><pytorch><dataloader>,6,
No module named 'parse_config' while tryhing to load checkpoint in PyTorch,https://stackoverflow.com/questions/64483065,<python><deep-learning><pytorch>,2,
Pytorch RuntimeError: expected scalar type Float but found Byte,https://stackoverflow.com/questions/64635630,<python><python-3.x><machine-learning><pytorch><pattern-recognition>,14,
Optuna Pytorch: returned value from the objective function cannot be cast to float,https://stackoverflow.com/questions/64781266,<pytorch><conv-neural-network><optuna><pytorch-ignite>,4,
RuntimeError: one of the variables needed for gradient computation has been modified by an inplace operation: PyTorch error,https://stackoverflow.com/questions/64933097,<python><neural-network><pytorch>,3,
How to solve the ValueError importing torch in python,https://stackoverflow.com/questions/64948852,<python><pytorch><torch>,2,
"""Didn't find engine for operation quantized"" error while using dynamic quantization with Huggingface transformer",https://stackoverflow.com/questions/64968060,<deep-learning><pytorch><quantization>,5,
RuntimeError: The size of tensor a (4000) must match the size of tensor b (512) at non-singleton dimension 1,https://stackoverflow.com/questions/65023526,<python><deep-learning><pytorch><bert-language-model><huggingface-transformers>,9,
PyTorch error in trying to backward through the graph a second time,https://stackoverflow.com/questions/65050791,<python><deep-learning><pytorch><backpropagation><autograd>,2,
"Pytorch ValueError: Expected target size (2, 13), got torch.Size([2]) when calling CrossEntropyLoss",https://stackoverflow.com/questions/65066981,<python><python-3.x><neural-network><pytorch>,2,
Feeding Multiple Inputs to LSTM for Time-Series Forecasting using PyTorch,https://stackoverflow.com/questions/65144346,<machine-learning><deep-learning><time-series><pytorch><lstm>,5,
LSTM Autoencoder problems,https://stackoverflow.com/questions/65205506,<python><neural-network><pytorch><lstm><autoencoder>,12,
AssertionError: No inf checks were recorded for this optimizer in Pytorch's AutomaticMixedPrecision,https://stackoverflow.com/questions/65428216,<python><deep-learning><pytorch>,5,
BERT Based CNN - Convolution and Maxpooling,https://stackoverflow.com/questions/65447378,<deep-learning><neural-network><pytorch><conv-neural-network><huggingface-transformers>,2,
How to dump confusion matrix using TensorBoard logger in pytorch-lightning?,https://stackoverflow.com/questions/65498782,<python><deep-learning><pytorch><tensorboard><pytorch-lightning>,8,
"ValueError: Target size (torch.Size([1000])) must be the same as input size (torch.Size([1000, 1]))",https://stackoverflow.com/questions/65537991,<neural-network><pytorch><loss-function>,3,
Pytorch torch.load ModuleNotFoundError: No module named 'utils',https://stackoverflow.com/questions/65538179,<python><machine-learning><pytorch>,3,
ResNet object has no attribute 'predict',https://stackoverflow.com/questions/65647833,<python><numpy><machine-learning><pytorch><classification>,2,
